Topic,Count,Name,Representation,Representative_Docs
6,205,6_Text Imaging Technologies,['Text Imaging Technologies'],"['VCP-PR Praktikum Visual Computing Projekt-Praktikum: TextImaging Das Praktikum TextImager thematisiert das teilautomatische Lesen von natürlichsprachlichen Texten (machine close reading und machine distant reading). Technologien dieser Art unterstützen Menschen darin, Informationen aus Texten einfacher, schneller und nachhaltiger zu beziehen. Das Praktikum zielt auf die Implementation solcher Technologien mit Hilfe des Frameworks namens TextImager der AG Texttechnologie. Es geht dabei insbesondere um die Erprobung von bildgebenden Verfahren, mit denen die Inhalte von Texten automatisch visualisiert werden können. Diese Verfahren vermitteln einen visuellen Zugang für das Textverstehen und schlagen somit eine Brücke zwischen symbolischen und visuellen Methoden der Informationsverarbeitung. Das Praktikum, dessen Schwerpunkt im Bereich der angewandten bzw. praktischen Informatik liegt, vermittelt seinen Teilnehmerinnen und Teilnehmern ein breites Spektrum an Themen. Diese reichen von der Implementierung neuester Text-Mining-Verfahren (deep learning) bis hin zur Visualisierung von textuellen, semantischen Daten.  Stichwörter  Text Mining, Deep Learning, Machine Reading, Distant Reading, Visualisation  Lernziele:  Die Teilnehmer sollen in Gruppenarbeit den TextImager modular erweitern. Aus programmiertechnischer Sicht soll vor allem der Umgang mit Java, JavaScript, objektorientiertem Programmieren und die deduktive Sicht auf das Programmieren vermittelt werden. Andere Programmiersprachen sind ebenso willkommen. Aus der Sicht des Machine Learning geht es vor allem um die Anwendung von Verfahren des Deep Learning (neuronale Netze) und verwandter Verfahren auf die Inhalte von Texten. Im Bereich der Visualisierung wiederum stehen vor allem Verfahren für interaktive Graphiken im Vordergrund (Stichwort: interaktives Information Retrieval).\r\r\nNeben Programmieraufgaben existiert eine Reihe von Datenerhebungs- und Modellierungsaufgaben, welche ebenso in Gruppenarbeit gelöst werden können. Erforderliche Vorkenntnisse:  \xa0\xa0\xa0 - Java oder JavaScript (andere Programmiersprachen sind ebenso willkommen)  Nützliche Vorkenntnisse:  \xa0\xa0\xa0 - Texttechnologie 1 und 2  \xa0\xa0\xa0 - Machine Learning  \xa0\xa0\xa0 - d3.js\r\r\n\r\r\nZuordnung im Gebiet: Angewandte Informatik', 'Visual Computing Praktikum: Deep Learning for TextImaging Das Praktikum TextImager thematisiert das teilautomatische Lesen von natürlichsprachlichen Texten (machine close reading und machine distant reading). Technologien dieser Art unterstützen Menschen darin, Informationen aus Texten einfacher, schneller und nachhaltiger zu beziehen. Das Praktikum zielt auf die Implementation solcher Technologien mit Hilfe des Frameworks namens TextImager der AG Texttechnologie. Es geht dabei insbesondere um die Erprobung von bildgebenden Verfahren, mit denen die Inhalte von Texten automatisch visualisiert werden können. Diese Verfahren vermitteln einen visuellen Zugang für das Textverstehen und schlagen somit eine Brücke zwischen symbolischen und visuellen Methoden der Informationsverarbeitung. Das Praktikum, dessen Schwerpunkt im Bereich der angewandten bzw. praktischen Informatik liegt, vermittelt seinen Teilnehmerinnen und Teilnehmern ein breites Spektrum an Themen. Diese reichen von der Implementierung neuester Text-Mining-Verfahren (deep learning) bis hin zur Visualisierung von textuellen, semantischen Daten.  Stichwörter  Text Mining, Deep Learning, Machine Reading, Distant Reading, Visualisation  Lernziele:  Die Teilnehmer sollen in Gruppenarbeit den TextImager modular erweitern. Aus programmiertechnischer Sicht soll vor allem der Umgang mit Java, JavaScript, objektorientiertem Programmieren und die deduktive Sicht auf das Programmieren vermittelt werden. Andere Programmiersprachen sind ebenso willkommen. Aus der Sicht des Machine Learning geht es vor allem um die Anwendung von Verfahren des Deep Learning (neuronale Netze) und verwandter Verfahren auf die Inhalte von Texten. Im Bereich der Visualisierung wiederum stehen vor allem Verfahren für interaktive Graphiken im Vordergrund (Stichwort: interaktives Information Retrieval).\r\r\nNeben Programmieraufgaben existiert eine Reihe von Datenerhebungs- und Modellierungsaufgaben, welche ebenso in Gruppenarbeit gelöst werden können. Erforderliche Vorkenntnisse:  \xa0\xa0\xa0 - Java oder JavaScript (andere Programmiersprachen sind ebenso willkommen)  Nützliche Vorkenntnisse:  \xa0\xa0\xa0 - Texttechnologie 1 und 2  \xa0\xa0\xa0 - Machine Learning  \xa0\xa0\xa0 - d3.js', 'Visual Computing Praktikum: TextImaging Das Praktikum TextImager thematisiert das teilautomatische Lesen von natürlichsprachlichen Texten (machine close reading und machine distant reading). Technologien dieser Art unterstützen Menschen darin, Informationen aus Texten einfacher, schneller und nachhaltiger zu beziehen. Das Praktikum zielt auf die Implementation solcher Technologien mit Hilfe des Frameworks namens TextImager der AG Texttechnologie. Es geht dabei insbesondere um die Erprobung von bildgebenden Verfahren, mit denen die Inhalte von Texten automatisch visualisiert werden können. Diese Verfahren vermitteln einen visuellen Zugang für das Textverstehen und schlagen somit eine Brücke zwischen symbolischen und visuellen Methoden der Informationsverarbeitung. Das Praktikum, dessen Schwerpunkt im Bereich der angewandten bzw. praktischen Informatik liegt, vermittelt seinen Teilnehmerinnen und Teilnehmern ein breites Spektrum an Themen. Diese reichen von der Implementierung neuester Text-Mining-Verfahren (deep learning) bis hin zur Visualisierung von textuellen, semantischen Daten.  Stichwörter  Text Mining, Deep Learning, Machine Reading, Distant Reading, Visualisation  Lernziele:  Die Teilnehmer sollen in Gruppenarbeit den TextImager modular erweitern. Aus programmiertechnischer Sicht soll vor allem der Umgang mit Java, JavaScript, objektorientiertem Programmieren und die deduktive Sicht auf das Programmieren vermittelt werden. Andere Programmiersprachen sind ebenso willkommen. Aus der Sicht des Machine Learning geht es vor allem um die Anwendung von Verfahren des Deep Learning (neuronale Netze) und verwandter Verfahren auf die Inhalte von Texten. Im Bereich der Visualisierung wiederum stehen vor allem Verfahren für interaktive Graphiken im Vordergrund (Stichwort: interaktives Information Retrieval).\r\r\nNeben Programmieraufgaben existiert eine Reihe von Datenerhebungs- und Modellierungsaufgaben, welche ebenso in Gruppenarbeit gelöst werden können. Erforderliche Vorkenntnisse:  \xa0\xa0\xa0 - Java oder JavaScript (andere Programmiersprachen sind ebenso willkommen)  Nützliche Vorkenntnisse:  \xa0\xa0\xa0 - Texttechnologie 1 und 2  \xa0\xa0\xa0 - Machine Learning  \xa0\xa0\xa0 - d3.js']"
7,197,7_Fuzzy methods in education,['Fuzzy methods in education'],"[""Praktische Übung zu: Fuzzy-Methoden Kurzfassung: Fuzzy-Methoden gehören zu den wichtigsten Soft-Computing- und Computational-Intelligenz-Verfahren, die in der letzten Zeit immer mehr Aufmerksamkeit in der Forschung und Technik finden. Fuzzy-Methoden sind eine Erweiterung von konventionellen Daten- und Wissensverarbeitungsverfahren, die auf der zweiwertigen Booleschen Logik basieren und nur die scharfen Grenzen zwischen den Klassen unterscheiden. Die Fuzzy-Erweiterung bedeutet hier eine Integration des Konzepts der unscharfen (fuzzy) Menge und der Fuzzy-Logik in diese Verfahren, um die Verarbeitung von unexakten und unsicheren Daten und vagem Wissen zu ermöglichen und damit die Anwendungsmöglichkeiten von konventionellen Verfahren zu erweitern. Die Fuzzy-Methoden haben viele erfolgreiche Anwendungen in verschiedenen Forschungsgebieten und in der Industrie gefunden. Das Modul besteht aus der Vorlesung `Fuzzy-Methoden' (2 SWS, im WS) und den zu dieser Vorlesung zugeordneten Übungen (1 SWS) und Praktischen Übungen (1 SWS). Lernziele: In diesem Modul werden die Studierenden sowohl die theoretischen Grundlagen der Fuzzy-Logik als auch die typischen Anwendungsbereiche kennen lernen und mit dem Einsatz von einigen Fuzzy-Methoden im Rahmen der praktischen Übungen vertraut gemacht. Lehrinhalte: Schwerpunkte des Moduls: Approximatives Schließen, Fuzzy-Logik, Wissensbasierte (Regelbasierte) Systeme, Fuzzy-Datenanalyse, Fuzzy-Optimierung (LP), Fuzzy-Regelung. Im Rahmen der praktischen Übungen werden die Studierenden zwei weltweit verbreitete Software-Pakete (Fuzzy Logic Toolbox von MatLab und FuzzyJess) kennen lernen."", ""Praktische Übung zu: Fuzzy-Methoden Kurzfassung: Fuzzy-Methoden gehören zu den wichtigsten Soft-Computing- und Computational-Intelligenz-Verfahren, die in der letzten Zeit immer mehr Aufmerksamkeit in der Forschung und Technik finden. Fuzzy-Methoden sind eine Erweiterung von konventionellen Daten- und Wissensverarbeitungsverfahren, die auf der zweiwertigen Booleschen Logik basieren und nur die scharfen Grenzen zwischen den Klassen unterscheiden. Die Fuzzy-Erweiterung bedeutet hier eine Integration des Konzepts der unscharfen (fuzzy) Menge und der Fuzzy-Logik in diese Verfahren, um die Verarbeitung von unexakten und unsicheren Daten und vagem Wissen zu ermöglichen und damit die Anwendungsmöglichkeiten von konventionellen Verfahren zu erweitern. Die Fuzzy-Methoden haben viele erfolgreiche Anwendungen in verschiedenen Forschungsgebieten und in der Industrie gefunden. Das Modul besteht aus der Vorlesung `Fuzzy-Methoden' (2 SWS, im WS) und den zu dieser Vorlesung zugeordneten Übungen (1 SWS) und Praktischen Übungen (1 SWS). Lernziele: In diesem Modul werden die Studierenden sowohl die theoretischen Grundlagen der Fuzzy-Logik als auch die typischen Anwendungsbereiche kennen lernen und mit dem Einsatz von einigen Fuzzy-Methoden im Rahmen der praktischen Übungen vertraut gemacht. Lehrinhalte: Schwerpunkte des Moduls: Approximatives Schließen, Fuzzy-Logik, Wissensbasierte (Regelbasierte) Systeme, Fuzzy-Datenanalyse, Fuzzy-Optimierung (LP), Fuzzy-Regelung. Im Rahmen der praktischen Übungen werden die Studierenden zwei weltweit verbreitete Software-Pakete (Fuzzy Logic Toolbox von MatLab und FuzzyJess) kennen lernen."", ""Praktische Übung zu: Fuzzy-Methoden Kurzfassung: Fuzzy-Methoden gehören zu den wichtigsten Soft-Computing- und Computational-Intelligenz-Verfahren, die in der letzten Zeit immer mehr Aufmerksamkeit in der Forschung und Technik finden. Fuzzy-Methoden sind eine Erweiterung von konventionellen Daten- und Wissensverarbeitungsverfahren, die auf der zweiwertigen Booleschen Logik basieren und nur die scharfen Grenzen zwischen den Klassen unterscheiden. Die Fuzzy-Erweiterung bedeutet hier eine Integration des Konzepts der unscharfen (fuzzy) Menge und der Fuzzy-Logik in diese Verfahren, um die Verarbeitung von unexakten und unsicheren Daten und vagem Wissen zu ermöglichen und damit die Anwendungsmöglichkeiten von konventionellen Verfahren zu erweitern. Die Fuzzy-Methoden haben viele erfolgreiche Anwendungen in verschiedenen Forschungsgebieten und in der Industrie gefunden. Das Modul besteht aus der Vorlesung `Fuzzy-Methoden' (2 SWS, im WS) und den zu dieser Vorlesung zugeordneten Übungen (1 SWS) und Praktischen Übungen (1 SWS). Lernziele: In diesem Modul werden die Studierenden sowohl die theoretischen Grundlagen der Fuzzy-Logik als auch die typischen Anwendungsbereiche kennen lernen und mit dem Einsatz von einigen Fuzzy-Methoden im Rahmen der praktischen Übungen vertraut gemacht. Lehrinhalte: Schwerpunkte des Moduls: Approximatives Schließen, Fuzzy-Logik, Wissensbasierte (Regelbasierte) Systeme, Fuzzy-Datenanalyse, Fuzzy-Optimierung (LP), Fuzzy-Regelung. Im Rahmen der praktischen Übungen werden die Studierenden zwei weltweit verbreitete Software-Pakete (Fuzzy Logic Toolbox von MatLab und FuzzyJess) kennen lernen.""]"
8,183,8_Grundlagen der Hardwareinformatik,['Grundlagen der Hardwareinformatik'],"['Systemprogrammierung In diesem Praktikum werden theoretische Kenntnisse aus der Vorlesung Einführung in die Technische Informatik durch praktische Versuche vertieft sowie Konzepte hardwarenaher Programmierung vermittelt. Unter anderem werden folgende Themen behandelt: <ul><li>Analoge Schaltungen z.B. A/D-Wandlung</li><li>Scheduler</li><li>Interrupts/Polling</li><li>Ein- und Ausgabenanbindung</li><li>Speicherverwaltung</li><li>Anbindung von Peripherie z.B. RFID-Leser oder PS/2-Tastatur</li></ul>Neben der fachlichen Qualifikation wird in diesem Praktikum die Teamfähigkeit durch Bearbeitung der Aufgaben in Zweiergruppen trainiert.', 'Betriebssysteme und Systemsoftware (Vorlesung) <ul><li>Aufgaben und Struktur von Betriebssystemen</li><li>Das Betriebssystem Unix</li><li>Systemaufrufe und Shellprogrammierung</li><li>Einführung in die Programmiersprache C</li><li>Prozessverwaltung: Prozesse, Threads und Interprozesskommunikation</li><li>Prozess-Synchronisation, Nebenläufigkeit und Deadlocks</li><li>CPU-Scheduling</li><li>Speicherverwaltung: Segmentierung, Paging, Fragmentierung, virtueller Speicher</li><li>Stack- und Heap-Verwaltung, Garbage Collection</li><li>Dateisystem und Rechteverwaltung</li><li>I/O-System</li><li>Verteilte Systeme</li><li>Socket-Programmierung</li></ul>', 'Formale Methoden für Steuerungssoftware In dieser Vorlesung werden Grundlagen und Anwendungen von statischer Analyse und Model-Checking im Bereich Steuerungssoftware vermittelt. Dazu werden entsprechende Analysen und Algorithmen auf den zyklischen Betrieb von Speicherprogrammierbaren Steuerungen angepasst. Behandelte Themen sind u.A.: <ul> <li class=level1 node> Die Programmiersprache Structured Text <ul> <li class=level2> Definition nach IEC-61131-3 </li> <li class=level2> Formalisierung als Kontrollflussgraph </li> </ul> </li> <li class=level1 node> Statische Analyse <ul> <li class=level2 node> Datenflussanalysen <ul> <li class=level3> Ordnungstheoretische Grundlagen (Complete Lattice) </li> <li class=level3> Live Variables Analysis </li> <li class=level3> Reaching Definitions Analysis </li> <li class=level3> Value Set Analysis </li> </ul> </li> <li class=level2> Program Dependency Graphs </li> <li class=level2> Slicing </li> </ul> </li> <li class=level1 node> Abstract Interpretation <ul> <li class=level2> Galois-Verbindungen </li> <li class=level2> Structural Operational Semantics </li> <li class=level2> CEGAR-Variant for PLC State Space exploration </li> <li class=level2> Relational Domains </li> </ul> </li> <li class=level1 node> Specification and Model Checking <ul> <li class=level2> CTL </li> <li class=level2> Specification Automata </li> </ul> </li> <li class=level1 node> Logical Characterisation and Symbolic Reasoning <ul> <li class=level2> SMT encoding of Structured Text </li> <li class=level2> Symbolic Execution </li> <li class=level2> Large Block Encoding </li> <li class=level2> Bounded Model Checking </li> <li class=level2> IC3/PDR </li> </ul> </li> </ul>']"
9,171,9_Introduction to Programming,['Introduction to Programming'],"['Übung: Objektorientierte Programmierung (Übung 4, Di 12-14, Raum 3.34) Diese Veranstaltung ist eine Einführung in die Programmierung für das erste Semester. Es wird dabei die Programmiersprache Java als Beispiel verwendet. Wichtigstes Lernziel ist, dass die Teilnehmer anschließend (kleinere) Programme selbständig erstellen können. Sie sollen aber auch grundlegende Konzepte von (imperativen und objektorientierten) Programmiersprachen verstehen und erklären können, so dass die Einarbeitung in andere Programmiersprachen anschließend leicht möglich ist.', 'Übung: Objektorientierte Programmierung (Übung 1, Mo 12-14, Raum 3.34) Diese Veranstaltung ist eine Einführung in die Programmierung für das erste Semester. Es wird dabei die Programmiersprache Java als Beispiel verwendet. Wichtigstes Lernziel ist, dass die Teilnehmer anschließend (kleinere) Programme selbständig erstellen können. Sie sollen aber auch grundlegende Konzepte von (imperativen und objektorientierten) Programmiersprachen verstehen und erklären können, so dass die Einarbeitung in andere Programmiersprachen anschließend leicht möglich ist.', 'Übung: Objektorientierte Programmierung (Übung 1, Mo 12-14, Raum 3.34) Diese Veranstaltung ist eine Einführung in die Programmierung für das erste Semester. Es wird dabei die Programmiersprache Java als Beispiel verwendet. Wichtigstes Lernziel ist, dass die Teilnehmer anschließend (kleinere) Programme selbständig erstellen können. Sie sollen aber auch grundlegende Konzepte von (imperativen und objektorientierten) Programmiersprachen verstehen und erklären können, so dass die Einarbeitung in andere Programmiersprachen anschließend leicht möglich ist.']"
10,159,10_Logic in Computer Science,['Logic in Computer Science'],"[""Quanteninformationstheorie Die Idee der Datenübertragung und -speicherung unter Verwendung der Eigenschaften physikalischer Systeme auf der atomaren Skala hat in den vergangenen Jahrzehnten ganze Gebiete experimenteller sowie theoretischer Forschung eröffnet.\r\nDas vorliegende Modul soll in die mathematische Modellierung von Quanten-Kommunikationssystemen mittels des aus der klassischen Informationstheorie bekannten Shannon'schen Zugang einführen.\r\n\r\nSowohl von der Themenauswahl als auch der methodischen Herangehensweise stellt das Modul eine konsequente Fortführung des Inhaltes entsprechender Module im Themenbereich klassische Informationstheorie dar. Explizit behandelt werden:\r\n- die mathematischen und konzeptuellen Grundlagen der Beschreibung von Quantensystemen mit endlichen Freiheitsgraden mit besonderem Fokus auf einen operationellen Zugang zur Quantentheorie\r\n- Quanten-Hypothesentests; Quanten-Stein's Lemma\r\n- Quellenkodierung für gedächtnislose Quanten-Quellen\r\n- Kodierungssätze für Übertragung klassischer Nachrichten über Semiklassische und Quantenmechanische gedächtnislose Kanäle\r\n- Fortgeschrittene Themen aus den Bereichen Informationstheoretische Sicherheit für Quantenmechanische Kanäle und Quellen, Verschränkungstheorie, Optimale Protokolle für die Generierung quantenmechanischer und klassischer Kommunikationsresourcen."", ""Quantum Information Theory Die Idee der Datenübertragung und -speicherung unter Verwendung der Eigenschaften physikalischer Systeme auf der atomaren Skala hat in den vergangenen Jahrzehnten ganze Gebiete experimenteller sowie theoretischer Forschung eröffnet.\r\nDas vorliegende Modul soll in die mathematische Modellierung von Quanten-Kommunikationssystemen mittels des aus der klassischen Informationstheorie bekannten Shannon'schen Zugang einführen.\r\n\r\nSowohl von der Themenauswahl als auch der methodischen Herangehensweise stellt das Modul eine konsequente Fortführung des Inhaltes entsprechender Module im Themenbereich klassische Informationstheorie dar. Explizit behandelt werden:\r\n- die mathematischen und konzeptuellen Grundlagen der Beschreibung von Quantensystemen mit endlichen Freiheitsgraden mit besonderem Fokus auf einen operationellen Zugang zur Quantentheorie\r\n- Quanten-Hypothesentests; Quanten-Stein's Lemma\r\n- Quellenkodierung für gedächtnislose Quanten-Quellen\r\n- Kodierungssätze für Übertragung klassischer Nachrichten über Semiklassische und Quantenmechanische gedächtnislose Kanäle\r\n- Fortgeschrittene Themen aus den Bereichen Informationstheoretische Sicherheit für Quantenmechanische Kanäle und Quellen, Verschränkungstheorie, Optimale Protokolle für die Generierung quantenmechanischer und klassischer Kommunikationsresourcen."", ""Quantum Information Theory Die Idee der Datenübertragung und -speicherung unter Verwendung der Eigenschaften physikalischer Systeme auf der atomaren Skala hat in den vergangenen Jahrzehnten ganze Gebiete experimenteller sowie theoretischer Forschung eröffnet.\r\nDas vorliegende Modul soll in die mathematische Modellierung von Quanten-Kommunikationssystemen mittels des aus der klassischen Informationstheorie bekannten Shannon'schen Zugang einführen.\r\n\r\nSowohl von der Themenauswahl als auch der methodischen Herangehensweise stellt das Modul eine konsequente Fortführung des Inhaltes entsprechender Module im Themenbereich klassische Informationstheorie dar. Explizit behandelt werden:\r\n- die mathematischen und konzeptuellen Grundlagen der Beschreibung von Quantensystemen mit endlichen Freiheitsgraden mit besonderem Fokus auf einen operationellen Zugang zur Quantentheorie\r\n- Quanten-Hypothesentests; Quanten-Stein's Lemma\r\n- Quellenkodierung für gedächtnislose Quanten-Quellen\r\n- Kodierungssätze für Übertragung klassischer Nachrichten über Semiklassische und Quantenmechanische gedächtnislose Kanäle\r\n- Fortgeschrittene Themen aus den Bereichen Informationstheoretische Sicherheit für Quantenmechanische Kanäle und Quellen, Verschränkungstheorie, Optimale Protokolle für die Generierung quantenmechanischer und klassischer Kommunikationsresourcen.""]"
11,128,11_Einführung in Datenbanken,['Einführung in Datenbanken'],"['Datenbanken und Informationssysteme ', 'Datenbanken und Informationssysteme I - Übungen ', 'Forschungsseminar - Datenbanken und Informationssysteme ']"
