Topic,Count,Name,Representation,Representative_Docs
-1,2024,-1_Human-Computer Interaction,['Human-Computer Interaction'],"['Praktikum DBMS: Ubiquitous Texttechnologies Im Praktikum Stolperwege sind die Studierenden beteiligt an der Planung, Realisierung und Weiterentwicklung einer gleichnamigen mobilen Applikation, die eine prototypische Kommunikationstechnologie sowie deren notwendige Vorarbeiten für eine mobile Public History of the Holocaust darstellt. Hierbei wird eine zentrale Herausforderung für die Vermittlung der Geschichte des Holocaust aufgegriffen und in Anknüpfung an neueste Entwicklungen von Kommunikationsmedien bearbeitet. Die StolperwegeApp richtet sich somit an Schülerinnen und Schüler, Bewohnerinnen und Bewohner, Historikerinnen und Historiker und allgemein an Besucherinnen und Besucher einer Stadt, die vor Ort den Spuren des Holocaust nachspüren wollen, um sich an der Schreibung einer Public History of the Holocaust aktiv zu beteiligen.\r\r\nWebseite:http://www.stolperwege.hucompute.org\r\r\n\xa0\r\r\nLernziele:\r\r\nDie Teilnehmer sollen in Gruppenarbeiten die mobile Applikation namens StolperwegeApp weiterentwickeln. Aus programmiertechnischer Sicht soll vor allem der Umgang mit Java, der Erstellung von Android-Apps, die Verwendung von Frameworks, objektorientiertes Programmieren sowie die Vernetzung innerhalb größerer Programmierprojekte vermittelt werden. Aus datenbankpraktischer Sicht geht es um die Vermittlung neuester Datenbanktechnologien (Stichwort Graphdatenbanken). Schließlich werden aus texttechnologischer Sicht neueste Verfahren für die automatische Sprachverarbeitung und das Ontology Mining vermittelt (Stichwort deep learning).\r\r\nNeben Programmieraufgaben existiert eine Reihe von Datenerhebungs- und Modellierungsaufgaben, welche ebenso in Gruppenarbeit gelöst werden können.\r\r\n\xa0\r\r\nNützliche Vorkenntnisse:\r\r\n\xa0\xa0\xa0 - Java\r\r\n\xa0\xa0\xa0 - PRG-1\r\r\n\xa0\xa0\xa0 - Datenbanken\r\r\n\xa0\xa0\xa0 - Mobile Computing\r\r\n\xa0\xa0 - Texttechnologie I\r\r\n\xa0\r\r\nStichwörter:\r\r\nMobile Computing\r\r\nApp-Programming\r\r\nPublic-History\r\r\nRelation Extraction\r\r\nOntology Mining\r\r\nDeep Learning\r\r\n\r\r\nZuordnung im Gebiet: Informatik der Systeme', 'Visual Computing Praktikum: Ubiquitous Texttechnologies Im Praktikum Stolperwege sind die Studierenden beteiligt an der Planung, Realisierung und Weiterentwicklung einer gleichnamigen mobilen Applikation, die eine prototypische Kommunikationstechnologie sowie deren notwendige Vorarbeiten für eine mobile Public History of the Holocaust darstellt. Hierbei wird eine zentrale Herausforderung für die Vermittlung der Geschichte des Holocaust aufgegriffen und in Anknüpfung an neueste Entwicklungen von Kommunikationsmedien bearbeitet. Die StolperwegeApp richtet sich somit an Schülerinnen und Schüler, Bewohnerinnen und Bewohner, Historikerinnen und Historiker und allgemein an Besucherinnen und Besucher einer Stadt, die vor Ort den Spuren des Holocaust nachspüren wollen, um sich an der Schreibung einer Public History of the Holocaust aktiv zu beteiligen.\r\r\nWebseite:http://www.stolperwege.hucompute.org\r\r\n\xa0\r\r\nLernziele:\r\r\nDie Teilnehmer sollen in Gruppenarbeiten die mobile Applikation namens StolperwegeApp weiterentwickeln. Aus programmiertechnischer Sicht soll vor allem der Umgang mit Java, der Erstellung von Android-Apps, die Verwendung von Frameworks, objektorientiertes Programmieren sowie die Vernetzung innerhalb größerer Programmierprojekte vermittelt werden. Aus datenbankpraktischer Sicht geht es um die Vermittlung neuester Datenbanktechnologien (Stichwort Graphdatenbanken). Schließlich werden aus texttechnologischer Sicht neueste Verfahren für die automatische Sprachverarbeitung und das Ontology Mining vermittelt (Stichwort deep learning).\r\r\nNeben Programmieraufgaben existiert eine Reihe von Datenerhebungs- und Modellierungsaufgaben, welche ebenso in Gruppenarbeit gelöst werden können.\r\r\n\xa0\r\r\nNützliche Vorkenntnisse:\r\r\n\xa0\xa0\xa0 - Java\r\r\n\xa0\xa0\xa0 - PRG-1\r\r\n\xa0\xa0\xa0 - Datenbanken\r\r\n\xa0\xa0\xa0 - Mobile Computing\r\r\n\xa0\xa0 - Texttechnologie I\r\r\n\xa0\r\r\nStichwörter:\r\r\nMobile Computing\r\r\nApp-Programming\r\r\nPublic-History\r\r\nRelation Extraction\r\r\nOntology Mining\r\r\nDeep Learning\r\r\n\r\r\nMaster Vertiefungsgebiet: Angewandte Informatik\r\r\nSpezialisierungsbereiche: Visual Computing, Knowledge Processing', 'Praktikum BKSPP: Ubiquitous Texttechnologies Im Praktikum Stolperwege sind die Studierenden beteiligt an der Planung, Realisierung und Weiterentwicklung einer gleichnamigen mobilen Applikation, die eine prototypische Kommunikationstechnologie sowie deren notwendige Vorarbeiten für eine mobile Public History of the Holocaust darstellt. Hierbei wird eine zentrale Herausforderung für die Vermittlung der Geschichte des Holocaust aufgegriffen und in Anknüpfung an neueste Entwicklungen von Kommunikationsmedien bearbeitet. Die StolperwegeApp richtet sich somit an Schülerinnen und Schüler, Bewohnerinnen und Bewohner, Historikerinnen und Historiker und allgemein an Besucherinnen und Besucher einer Stadt, die vor Ort den Spuren des Holocaust nachspüren wollen, um sich an der Schreibung einer Public History of the Holocaust aktiv zu beteiligen.\r\r\n\r\r\nLernziele:\r\r\n\r\r\nDie Teilnehmer sollen in Gruppenarbeiten die mobile Applikation namens StolperwegeApp weiterentwickeln. Aus programmiertechnischer Sicht soll vor allem der Umgang mit Java, der Erstellung von Android-Apps, die Verwendung von Frameworks, objektorientiertes Programmieren sowie die Vernetzung innerhalb größerer Programmierprojekte vermittelt werden. Aus datenbankpraktischer Sicht geht es um die Vermittlung neuester Datenbanktechnologien (Stichwort Graphdatenbanken). Schließlich werden aus texttechnologischer Sicht neueste Verfahren für die automatische Sprachverarbeitung und das Ontology Mining vermittelt (Stichwort deep learning).\r\r\n\r\r\nNeben Programmieraufgaben existiert eine Reihe von Datenerhebungs- und Modellierungsaufgaben, welche ebenso in Gruppenarbeit gelöst werden können.\r\r\nNützliche Vorkenntnisse:\r\r\n\xa0\xa0\xa0 - Java\r\r\n\xa0\xa0\xa0 - PRG-1\r\r\n\xa0\xa0\xa0 - Datenbanken\r\r\n\xa0\xa0\xa0 - Mobile Computing\r\r\n\xa0\xa0 - Texttechnologie I\r\r\n\xa0\r\r\nStichwörter:\r\r\nMobile Computing\r\r\nApp-Programming\r\r\nPublic-History\r\r\nRelation Extraction\r\r\nOntology Mining\r\r\nDeep Learning\r\r\n\r\r\n\r\r\n\r\r\n\r\r\nBachelor Vertiefungsgebiet: Angewandte Informatik/Informatik der Systeme\r\r\nMaster Vertiefungsgebiet: Angewandte Informatik/Informatik der Systeme\r\r\nSpezialisierungsbereiche: Visual Computing, Knowledge Processing']"
0,624,0_Scientific Work in Informatics,['Scientific Work in Informatics'],"['Informatik-Kolloquium ', 'Übung zu Informatik A ', 'Informatik-Kolloquium ']"
1,324,1_Software Engineering Project,['Software Engineering Project'],"['Software-Projektseminar ', 'Software-Praktikum ', 'Praktikum Software Engineering  ']"
2,316,2_Robotics and Deep Learning,['Robotics and Deep Learning'],"['Machine Learning ', ""Praktikum - Roboy Student Team (IN0012, IN2106, IN4188) What if you could help shape the world around a humanoid Robot? And a very special one indeed - because it's imitating the human musculoskeletal system, this robot is even harder to work with. But it is also immensely rewarding and likely you will never grow as much as you will during Roboy Student Team.\r\n\r\nYour investment? All of your time, your skill, your passion and your love. In return you might become part of the most unique robot team in the world - if you're selected.\r\n\r\nAt Roboy you not only build and control robots but also make them intelligent and so much more. We do full stack robotics, so here's the menu:\r\n- Cognition - Apply artificial intelligence to make the robot interactive\r\n- Control - Use state ot the art algorithms to tame the robot's mechanical complexity and solve the issues around locomotion, grasping, path planning, full body motion control, ...\r\n- Simulation - Robots break easily, in simulation not so much - use it to learn control paradigms before applying them to the hardware.\r\n- Sensory Processing - computer vision, computer audition, speech to text, text to speech, pose estimation, sensory skin and sensor fusion\r\n- Electrical Engineering - build the electronics of the robot, from power train to low-level control, from sensors to actuation control - and of course the embedded programming to make it work.\r\n- Mechanical Engineering - lightweight design, 3d printing, generative design, ergonomic design, biologically inspired actuation and skeleton - build the basis for the exoskeleton and prosthetics of the future.\r\n- Industrial Design - Make the robot look amazing, and the users fall in love with it.\r\n- Computational Neuroscience - Interface with the human body, implement biologically plausible algorithms on neuromorphic hardware, transferring algorithms from the human body to the robot.\r\n- Games - Use Roboy as an actor and build games around him - for children or grown ups!\r\n- Augmented and Virtual Reality - Build interfaces to remote control the robot, applications with or for Roboy.\r\n- UX - A robot needs to be controlled and it needs to be intuitive - build the interface to make Roboy\r\n- Auxiliary - Roboy is a big team and it needs the tools to be managed - from automated deployment, continuous integration to our fully digital inventory - we strive to become more efficient, so there is more time for awesome technology.\r\n- Skills - Combine all of the above and make Roboy do things: shake hands, serve ice cream, become a cook and much more.\r\n\r\nAt Roboy, this is not just a dream - we have a comprehensive list of hardware, people who know how to use it, always the newest gadgets (HTC Vive Pro, Magic Leap, GTX 2080TI, ...) and technologies and the necessary budget for you to build what needs to be built. Also you will get access to the MakerSpace and get to do the courses.\r\n\r\nRoboy is organised in agile processes that are adapted for interdisciplinary product development. We have combined the best of scrum, design thinking, systems engineering and a jolt of lean startup. And this is also the only thing we teach, the rest requires your willingness to learn on your own and desire to create something amazing."", ""Masterpraktikum - Advanced Roboy Student Team (IN2106, IN4218) The Advanced Roboy Student Team is the successor to the Roboy Student Team and requires to have completed Roboy Student Team. \r\n\r\nWhat if you could help shape the world around a humanoid Robot? And a very special one indeed - because it's imitating the human musculoskeletal system, this robot is even harder to work with. But it is also immensely rewarding and likely you will never grow as much as you will during Roboy Student Team. \r\n\r\nYour investment? All of your time, your skill, your passion and your love. In return you might become part of the most unique robot team in the world - if you're selected.\r\n\r\nAt Roboy you not only build and control robots but also make them intelligent and so much more. We do full stack robotics, so here's the menu:\r\n- Cognition - Apply artificial intelligence to make the robot interactive\r\n- Control - Use state ot the art algorithms to tame the robot's mechanical complexity and solve the issues around locomotion, grasping, path planning, full body motion control, ...\r\n- Simulation - Robots break easily, in simulation not so much - use it to learn control paradigms before applying them to the hardware. \r\n- Sensory Processing - computer vision, computer audition, speech to text, text to speech, pose estimation, sensory skin and sensor fusion\r\n- Electrical Engineering - build the electronics of the robot, from power train to low-level control, from sensors to actuation control - and of course the embedded programming to make it work.\r\n- Mechanical Engineering - lightweight design, 3d printing, generative design, ergonomic design, biologically inspired actuation and skeleton - build the basis for the exoskeleton and prosthetics of the future.\r\n- Industrial Design - Make the robot look amazing, and the users fall in love with it.\r\n- Computational Neuroscience - Interface with the human body, implement biologically plausible algorithms on neuromorphic hardware, transferring algorithms from the human body to the robot. \r\n- Games - Use Roboy as an actor and build games around him - for children or grown ups!\r\n- Augmented and Virtual Reality - Build interfaces to remote control the robot, applications with or for Roboy.\r\n- UX - A robot needs to be controlled and it needs to be intuitive - build the interface to make Roboy \r\n- Auxiliary - Roboy is a big team and it needs the tools to be managed - from automated deployment, continuous integration to our fully digital inventory - we strive to become more efficient, so there is more time for awesome technology. \r\n- Skills - Combine all of the above and make Roboy do things: shake hands, serve ice cream, become a cook and much more. \r\n\r\nAt Roboy, this is not just a dream - we have a comprehensive list of hardware, people who know how to use it, always the newest gadgets (HTC Vive Pro, Magic Leap, GTX 2080TI, ...) and technologies and the necessary budget for you to build what needs to be built. Also you will get access to the MakerSpace and get to do the courses. \r\n\r\nRoboy is organised in agile processes that are adapted for interdisciplinary product development. We have combined the best of scrum, design thinking, systems engineering and a jolt of lean startup. And this is also the only thing we teach, the rest requires your willingness to learn on your own and desire to create something amazing.""]"
3,261,3_Wirtschaftsinformatik und IT-Management,['Wirtschaftsinformatik und IT-Management'],"['WInf-InfWiMa: Informations- und Wissensmanagement EINFÜHRUNG Einführung ins Thema: Daten, Information, Wissen, Wissensmanagement Abgrenzung Content-Management, Informationsmanagement und Wissensmanagement Modelle für Wissensmanagement TECHNOLOGIEN Informations- und Webtechnologien für Wissensmanagement Wissensmanagementsysteme Semantische Technologien ANWENDUNG von TECHNOLOGIEN Wissensteilung und -kommunikation Wissensretrieval und -visualisierung Geschäftsprozesse Personalisierung WEB 2.0 Social Software und Web2.0 Einsatz von Web 2.0 in Unternehmen Einsatz von Web 2.0 in der Wissensschaft DIE UNTERNEHMENSPRAXIS Lessons Learned in Praxisprojekten Wissensmanagement und Qualitätsmanagement Wissensmanagement und Projektmanagement', 'WInf-InfWiMa: Informations- und Wissensmanagement EINFÜHRUNG Einführung ins Thema: Daten, Information, Wissen, Wissensmanagement Abgrenzung Content-Management, Informationsmanagement und Wissensmanagement Modelle für Wissensmanagement TECHNOLOGIEN Informations- und Webtechnologien für Wissensmanagement Wissensmanagementsysteme Semantische Technologien ANWENDUNG von TECHNOLOGIEN Wissensteilung und -kommunikation Wissensretrieval und -visualisierung Geschäftsprozesse Personalisierung WEB 2.0 Social Software und Web2.0 Einsatz von Web 2.0 in Unternehmen Einsatz von Web 2.0 in der Wissensschaft DIE UNTERNEHMENSPRAXIS Lessons Learned in Praxisprojekten Wissensmanagement und Qualitätsmanagement Wissensmanagement und Projektmanagement', 'Wirtschaftsinformatik 2 Lernziele\r\r\nStudierenden werden mit den wichtigsten Fragestellungen im betrieblichen Informationsmanagement und mit strategischen Informationssystemen vertraut gemacht. Sie erhalten grundlegende theoretische Kompetenzen auf diesem Gebiet und lernen dieses Wissen kritisch anzuwenden. (LGB-1)\r\r\nStudierende erlernen den Umgang mit grundlegenden Methoden und Werkzeugen der Wirtschaftsinformatik und somit die analytische sowie strukturierte Durchdingung relevanter Problemstellungen. (LGB-2, LGB-3, LGB-5)\r\r\nIm Rahmen der Veranstaltung werden zahlreiche Praxisbeispiele und Fallstudien, die Informationsmanagement in verschiedenen Industrien beleuchten, behandelt. Insbesondere in den angebotenen Übungen und Mentorien wird die Fähigkeit der Studierenden geschult, das erlangte Wissen praktisch anzuwenden. (LGB-3)\r\r\nDurch Gruppenarbeiten üben Studierende die erfolgreiche Zusammenarbeit mit anderen. Ferner trainieren sie weitere Soft Skills wie etwa Präsentationsfähigkeiten, indem sie eingereichte schriftliche Arbeiten im Rahmen der Mentorien mündlich vortragen. (LGB-6, LGB-7)\r\r\nModulbeschreibung\r\r\nBasierend auf der Vorlesung Wirtschaftsinformatik 1 (OWIN) vermittelt dieser Kurs die Grundlagen von Informations- und Kommunikationssystemen (IuK-Systeme) und behandelt u.a. deren Entwicklung und Einführung in Unternehmen. Die Veranstaltung lässt sich grob in folgende vier Teile gliedern:\r\r\nIm ersten Teil werden Bedeutung und Charakteristika von IuK-Systemen in Unternehmen rekapituliert und eine kurze Einführung in die Unternehmensmodellierung gegeben.\r\r\nDer zweite Teil geht mehr ins Detail und widmet sich der Architektur und Funktionalität von IuK-Systemen. Es werden ferner die beiden miteinander verwandten Konzepte Informationssysteme (IS) und Kommunikationssysteme definiert und voneinander abgegrenzt. Dieser Abgrenzung folgend, werden IS-Architekturen und entsprechende IS-Modelle diskutiert und schichtenbasierte Kommunikation und Netzwerktechnologien für Kommunikationssysteme vorgestellt.\r\r\nDer dritte Teil adressiert die Entwicklung von IuK-Systemen und erläutert zunächst verschiedene Konzepte für das Management von IT-Projekten. Anschließend werden Vorgehensmodelle zur Softwareentwicklung vorgestellt. Da die Modellierung von IuK-Systemen ein integraler Bestandteil solcher Vorgehensmodelle darstellt, werden ebenso verschiedene Modellierungsansätze (z.B. zur objekt- und datenorientierten Modellierung) vermittelt. Als exemplarische Sprache zur Modell-Implementierung wird die Structured Query Language (SQL) behandelt - der für IuK-Systeme wichtigsten Sprache für den Zugriff auf ihre Anwendungsdaten.\r\r\nDer Kurs schließt mit einer Einführung in das Thema Business Process Reengineering (BPR). Unternehmen sind ständig gefordert, ihre Prozesse neuen Unternehmenszielen anzupassen oder ihre Effektivität und Prozesseffizienz zu verbessern. Obwohl auch traditionell damit eine Anpassung der Geschäftsprozesse sowie Optimierungsmaßnahmen verbunden sind, verlangt der BPR-Ansatz im Gegensatz dazu eine radikale Neugestaltung der Geschäftsprozesse']"
4,224,4_Economics of Security and Privacy,['Economics of Security and Privacy'],"['Bachelor/Master-Seminar - Usable Security and Privacy (IN0014, IN2107, IN4932) During recent years, the requirement for secure and\r\nprivacy preserving computer systems is reaching higher\r\nand higher priority. Luckily, a variety of technologies\r\nalready exist, specifically designed to meet these\r\nrequirements. However, most technologies were not\r\ndesigned keeping usability in mind. Consequently,\r\nimportant questions arise when integrating and applying\r\nthese technologies: What are the implications on\r\nusability of computer systems? And vice versa, does\r\nusability have an impact on security and privacy? Are\r\nsecurity and privacy requirements conflicting with\r\n(mostly more important) functional requirements? Do\r\nthese conflicts lead to users rejecting secure systems?\r\nIs security and privacy versus usability an unavoidable\r\ntrade-off?\r\nCurrently, this trade-off tends to be either over-biased\r\ntowards functionality and usability, or security and\r\nprivacy. This seminar explores this problem and\r\ninvestigates state-of-the-art research on how to\r\nrebalance the trade-off. Moreover, based on related\r\nwork, students will identify new problems, formulate\r\nresearch questions and justify their relevance. Students\r\nwith exceptional and interesting ideas will be\r\nconsidered for theses or internships.', 'Information Security ', 'Security and Privacy ']"
5,205,5_Efficient Algorithms Design,['Efficient Algorithms Design'],"['Effiziente Algorithmen 1 Ein zentrales Problem der Informatik, ist der Entwurf von ressourcenschonenden Algorithmen. In der Veranstaltung werden deshalb fundamentale Fragestellungen im Entwurf und in der Analyse effizienter sequentieller Algorithmen und Datenstrukturen besprochen. Eine Auswahl der folgenden Themengebiete wird behandelt: Entwurfsmethoden für randomisierte Algorithmen wie etwa Stichproben, Fingerprinting und Random Walks.  Der Entwurf und die Analyse von Online-Algorithmen mit kleinem Wettbewerbsfaktor.  Die algorithmische Lösung wichtiger Probleme wie etwa Matching, Flüsse in Netzwerken, lineare Programmierung, String Matching oder algorithmische Probleme der Zahlentheorie.Methoden des Algorithm Engineering.Lernziele: Die Vermittlung wichtiger Entwurfs- und Analyseprinzipien, bzw. die Beschreibung und Analyse fundamentaler Algorithmen für deterministische, randomisierte oder Online-Berechnungen soll den eigenständigen Entwurf von effizienten Algorithmen ermöglichen. Ein weiteres Ziel ist die Fähigkeit, eine algorithmische Lösung im Himblick auf ihre Effizienz fundiert beurteilen zu können.', 'Seminar Algorithmen ', 'Übung zu Algorithmen ']"
